<?xml version="1.0" encoding="utf-8"?>
<!--XML file automatically generated by WorkVisual V6.0.15_Build0685.-->
<!--DO NOT EDIT-->
<EAWaggonDriverConfig xsi:noNamespaceSchemaLocation="../../../System/Common/Schemes/EAWaggonDriverConfig.xsd" xmlns:xsi="http://www.w3.org/2001/XMLSchema-instance">
  <Version Label="">
    <Info Version="KUKA V8.7" />
    <Schema Version="1" />
  </Version>
  <WaggonDriver ID="107">
    <Input>
      <Offset VendorID="24776" ProductCode="134" VarName="FSoE-Drive In.Command" Occurrence="0" Length="27" />
      <Offset VendorID="24776" ProductCode="48" VarName="FSoE-Drive In.Command" Occurrence="0" Length="75" />
    </Input>
    <Output>
      <Offset VendorID="24776" ProductCode="134" VarName="FSoE-Drive Out.Command" Occurrence="0" Length="27" />
      <Offset VendorID="24776" ProductCode="134" VarName="FSoE-Drive Out.UL-Lamp" Occurrence="0" Length="1" />
      <Offset VendorID="24776" ProductCode="48" VarName="FSoE-Drive Out.Command" Occurrence="0" Length="75" />
    </Output>
  </WaggonDriver>
  <WaggonDriver ID="110">
    <Input>
      <Offset VendorID="24776" ProductCode="50" VarName="TxPdo A/D.A/D extern" Occurrence="0" BitOffset="0" WDVarDescription="EMD-Data" />
    </Input>
  </WaggonDriver>
</EAWaggonDriverConfig>